{
    "name": "Sockets",
    "authors": [{
        "name": "Tumppi066",
        "url": "https://github.com/Tumppi066",
        "avatar": "https://avatars.githubusercontent.com/u/83072683?v=4"
    }],
    "description": "Plugin to make a data socket available mainly for the built in visualisation.",
    "version": "1.0",
    "modules": ["TruckSimAPI"]
}