{
    "name": "plugins.trafficlightdetection",
    "authors": [{
        "name": "Glas42",
        "url": "https://github.com/Glas42",
        "avatar": "https://avatars.githubusercontent.com/u/145870870?v=4"
    }],
    "description": "plugins.trafficlightdetection.description",
    "version": "0.7",
    "dependencies": [],
    "modules": ["TruckSimAPI", "ScreenCapture"]
}