{
    "name": "Map",
    "authors": [{
        "name": "Tumppi066",
        "url": "https://github.com/Tumppi066",
        "avatar": "https://avatars.githubusercontent.com/u/83072683?v=4"
    }],
    "description": "Map detection plugin.",
    "version": "1.0",
    "modules": ["TruckSimAPI", "ShowImage"]
}