{
    "name": "plugins.cruisecontrol",
    "authors": [{
        "name": "Glas42",
        "url": "https://github.com/Glas42",
        "avatar": "https://avatars.githubusercontent.com/u/145870870?v=4"
    }],
    "description": "plugins.cruisecontrol.description",
    "version": "1.0",
    "dependencies": [],
    "modules": ["TruckSimAPI", "SDKController"]
}